{
  "schemaVersion": "1.0",
  "state": "accepted",
  "source": {
    "repo": "github.com/LynnSingoei/OpenCppCoverage-ARM64",
    "baselineCommit": "3e518697ea761935574af486bacd5fcc1aeab363",
    "headCommit": "81376baeda1b5453c1fcfe6fc0a09ccec3f892c8",
    "branch": "repair/arm64-toolset-fail-closed",
    "immutableUrl": "https://github.com/LynnSingoei/OpenCppCoverage-ARM64/commit/81376baeda1b5453c1fcfe6fc0a09ccec3f892c8",
    "evidenceCommits": [
      "9d9ccdc7e6760c8375db92157d6d556ec1bd88d0",
      "7bbb02fd96944fce489639e554e981c47b75f3d9",
      "bf5cdc1c5fa988a71a584c60b8315e0fbc101b19",
      "e74bc2f750ae5c7a382e0c44c6e50f7237b31f69",
      "0c2ea8d7931100f919502025352d64adae934522"
    ]
  },
  "session": {
    "projectSessionId": "04911afc-02d8-4a30-b574-11ac0031e777",
    "branch": "repair/arm64-toolset-fail-closed",
    "reportedAt": "2026-08-20T10:41:00.000+03:00"
  },
  "changes": {
    "kind": "patch",
    "path": "source/opencppcoverage-arm64-81376ba.diff",
    "sha256": "67cc203135ea067ea84bc0b2952a30876402676ab845fa1ec3e1627c20c00535",
    "immutableUrl": "https://github.com/LynnSingoei/OpenCppCoverage-ARM64/commit/81376baeda1b5453c1fcfe6fc0a09ccec3f892c8"
  },
  "artifacts": [
    {
      "name": "Port diff from the upstream baseline to the accepted head, 93 files",
      "path": "source/opencppcoverage-arm64-81376ba.diff",
      "sourceCommit": "81376baeda1b5453c1fcfe6fc0a09ccec3f892c8",
      "size": 364477,
      "sha256": "67cc203135ea067ea84bc0b2952a30876402676ab845fa1ec3e1627c20c00535"
    },
    {
      "name": "Windows x64 compatibility job log from run 32357865925",
      "path": "evidence/x64-compat-run-32357865925-job-96390868985.log",
      "sourceCommit": "81376baeda1b5453c1fcfe6fc0a09ccec3f892c8",
      "size": 540866,
      "sha256": "839a46840ea9a3eb754825f74b0650ebb19404f7391943672bef52de548cd3f3"
    },
    {
      "name": "Windows x86 compatibility job log from run 32357865925",
      "path": "evidence/x86-compat-run-32357865925-job-96390869040.log",
      "sourceCommit": "81376baeda1b5453c1fcfe6fc0a09ccec3f892c8",
      "size": 537679,
      "sha256": "40271a08d631b1ee96e00d0cca5d2e4e5792187e0303feaed0e75f9ec45b12bf"
    },
    {
      "name": "Earlier immutable source handoff archive",
      "path": "source/OpenCppCoverage-9d9ccdc7e6760c8375db92157d6d556ec1bd88d0-source.zip",
      "sourceCommit": "9d9ccdc7e6760c8375db92157d6d556ec1bd88d0",
      "size": 1651368,
      "sha256": "e51071a89ca9850d0cf5e7efe5432fd4140d87c38fb9b744c6ee3ce31c9ecb74"
    },
    {
      "name": "Earlier immutable source handoff patch",
      "path": "source/0001-Add-native-Windows-ARM64-support.patch",
      "sourceCommit": "9d9ccdc7e6760c8375db92157d6d556ec1bd88d0",
      "size": 258391,
      "sha256": "157660404e9f51f3da6169bbd1a7c43051c968e2b859eb69f09efeb0a57114d1"
    },
    {
      "name": "Earlier rename-aware changed-file manifest",
      "path": "source/changed-files.txt",
      "sourceCommit": "9d9ccdc7e6760c8375db92157d6d556ec1bd88d0",
      "size": 2850,
      "sha256": "b027e9b198723c84256ced9717fb498ed4c2626d2cc207acda1cc7051d420c35"
    },
    {
      "name": "x86 dependency restore at the earlier handoff head",
      "path": "evidence/restore-x86-final.log",
      "sourceCommit": "9d9ccdc7e6760c8375db92157d6d556ec1bd88d0",
      "size": 10071,
      "sha256": "39922f4f62eef7f033c43f79a86ae12b07b0400ee6d0286efc6cc3bb5419c4ec"
    },
    {
      "name": "x86 Debug build at the earlier handoff head",
      "path": "evidence/build-debug-x86-final.log",
      "sourceCommit": "9d9ccdc7e6760c8375db92157d6d556ec1bd88d0",
      "size": 60845,
      "sha256": "21bdf559220f073d769c86f9f8cd048ddd207b31193a5ddc3ee64661dc447ace"
    },
    {
      "name": "x86 Debug tests at the earlier handoff head",
      "path": "evidence/tests-debug-x86-final.log",
      "sourceCommit": "9d9ccdc7e6760c8375db92157d6d556ec1bd88d0",
      "size": 34282,
      "sha256": "bf71670dfc75c5d4d5349a081c4dc27ffa8015c733c652dbd05050502a0c1edb"
    },
    {
      "name": "x64 dependency restore at the earlier handoff head",
      "path": "evidence/restore-x64-commit.log",
      "sourceCommit": "9d9ccdc7e6760c8375db92157d6d556ec1bd88d0",
      "size": 42874,
      "sha256": "28f576c2763e2074250034fe3306f91d7715f9ef52aa3dcfd0c7f7c7b25ca653"
    },
    {
      "name": "x64 Debug build at the earlier handoff head",
      "path": "evidence/build-debug-x64-commit.log",
      "sourceCommit": "9d9ccdc7e6760c8375db92157d6d556ec1bd88d0",
      "size": 167325,
      "sha256": "c3aabc7d71876d15016839a8a96ae51a106eb484ceab92900374584a2c007ab4"
    },
    {
      "name": "x64 Debug tests at the earlier handoff head",
      "path": "evidence/tests-debug-x64-commit.log",
      "sourceCommit": "9d9ccdc7e6760c8375db92157d6d556ec1bd88d0",
      "size": 34755,
      "sha256": "fcbb6e103aa6b2edf8ee4dc090e005934d8db44a5739454ba9a74ff20ab33ff7"
    },
    {
      "name": "x64 Release build at the earlier handoff head",
      "path": "evidence/build-release-x64-commit.log",
      "sourceCommit": "9d9ccdc7e6760c8375db92157d6d556ec1bd88d0",
      "size": 182763,
      "sha256": "3794562b585f00cad3d8b3a1e345ac00343018a82de12312f96405784e372671"
    },
    {
      "name": "x64 package creation at the earlier handoff head",
      "path": "evidence/package-x64-commit.log",
      "sourceCommit": "9d9ccdc7e6760c8375db92157d6d556ec1bd88d0",
      "size": 1013,
      "sha256": "1c69a8d07d161e08e93f1f1ce034584535d461eb3e04d2fb1cae296460378326"
    },
    {
      "name": "Host toolchain determinism analysis across runs 32347208182, 32349116627, and 32350427917",
      "path": "evidence/host-toolchain-determinism-analysis.txt",
      "sourceCommit": "e74bc2f750ae5c7a382e0c44c6e50f7237b31f69",
      "size": 5310,
      "sha256": "010743982729b4721fa563494df4e4fc649e3626a8dcf0eba8b409b7b3078e2c"
    },
    {
      "name": "Independent verification of the superseded arm64-e74bc2f release asset",
      "path": "evidence/release-arm64-e74bc2f-verification.txt",
      "sourceCommit": "e74bc2f750ae5c7a382e0c44c6e50f7237b31f69",
      "size": 2619,
      "sha256": "69eb90ec591a8670a2301678155c46cfd68b39fd23e3c1f40e6bd0a11eedf07f"
    },
    {
      "name": "Stable download alias verification for the superseded arm64-e74bc2f release",
      "path": "evidence/release-stable-alias-verification.txt",
      "sourceCommit": "e74bc2f750ae5c7a382e0c44c6e50f7237b31f69",
      "size": 2116,
      "sha256": "13da35a236b55cd297312c0f37cdf5bfd9d41e712147db1341c862b50578658a"
    },
    {
      "name": "Native ARM64 build, tests, E2E, and Release log from run 32350427917",
      "path": "evidence/build-tests-e2e-ARM64-run-32350427917.log",
      "sourceCommit": "0c2ea8d7931100f919502025352d64adae934522",
      "size": 15173,
      "sha256": "01fb95f9f3b0266ec47d3e77aae7bc76580aabbb3295f891dfcd8dacae6e4301"
    }
  ],
  "evidence": [
    {
      "kind": "build",
      "status": "pass",
      "path": "evidence/native-arm64-run-32357865925-job-96390868682.log",
      "sourceCommit": "81376baeda1b5453c1fcfe6fc0a09ccec3f892c8",
      "workflowUrl": "https://github.com/LynnSingoei/OpenCppCoverage-ARM64/actions/runs/32357865925",
      "command": "\"C:\\Program Files\\Microsoft Visual Studio\\2022\\Enterprise\\MSBuild\\Current\\Bin\\arm64\\MSBuild.exe\" /m CppCoverage.sln /p:Configuration=Debug /p:Platform=ARM64 /p:PreferredToolArchitecture=arm64",
      "exitCode": 0,
      "runnerType": "github-actions",
      "runner": "GitHub windows-11-arm; native ARM64; MSBuild 17.14.51.32402 arm64 host; MSVC 14.44.35207 HostArm64",
      "size": 540071,
      "sha256": "af70ba3a6d7402d092daa034b0590f50402d20c8507bdd6bd5eab93619f77603"
    },
    {
      "kind": "build",
      "status": "pass",
      "path": "evidence/native-arm64-run-32357865925-job-96390868682.log",
      "sourceCommit": "81376baeda1b5453c1fcfe6fc0a09ccec3f892c8",
      "workflowUrl": "https://github.com/LynnSingoei/OpenCppCoverage-ARM64/actions/runs/32357865925",
      "command": "\"C:\\Program Files\\Microsoft Visual Studio\\2022\\Enterprise\\MSBuild\\Current\\Bin\\arm64\\MSBuild.exe\" /m CppCoverage.sln /p:Configuration=Release /p:Platform=ARM64 /p:PreferredToolArchitecture=arm64",
      "exitCode": 0,
      "runnerType": "github-actions",
      "runner": "GitHub windows-11-arm; native ARM64; MSBuild 17.14.51.32402 arm64 host; MSVC 14.44.35207 HostArm64",
      "size": 540071,
      "sha256": "af70ba3a6d7402d092daa034b0590f50402d20c8507bdd6bd5eab93619f77603"
    },
    {
      "kind": "build",
      "status": "pass",
      "path": "evidence/native-arm64-run-32357865925-job-96390868682.log",
      "sourceCommit": "81376baeda1b5453c1fcfe6fc0a09ccec3f892c8",
      "workflowUrl": "https://github.com/LynnSingoei/OpenCppCoverage-ARM64/actions/runs/32357865925",
      "command": ".\\Build\\Scripts\\Assert-BuildToolchain.ps1 -ExpectedHost Hostarm64",
      "exitCode": 0,
      "runnerType": "github-actions",
      "runner": "GitHub windows-11-arm; native ARM64; MSBuild 17.14.51.32402 arm64 host; MSVC 14.44.35207 HostArm64",
      "size": 540071,
      "sha256": "af70ba3a6d7402d092daa034b0590f50402d20c8507bdd6bd5eab93619f77603"
    },
    {
      "kind": "test",
      "status": "pass",
      "path": "evidence/native-arm64-run-32357865925-job-96390868682.log",
      "sourceCommit": "81376baeda1b5453c1fcfe6fc0a09ccec3f892c8",
      "workflowUrl": "https://github.com/LynnSingoei/OpenCppCoverage-ARM64/actions/runs/32357865925",
      "command": ".\\Build\\Scripts\\RunTests.ps1 -Platform ARM64 -Configuration Debug",
      "exitCode": 0,
      "runnerType": "github-actions",
      "runner": "GitHub windows-11-arm; native ARM64; MSBuild 17.14.51.32402 arm64 host; MSVC 14.44.35207 HostArm64",
      "size": 540071,
      "sha256": "af70ba3a6d7402d092daa034b0590f50402d20c8507bdd6bd5eab93619f77603"
    },
    {
      "kind": "test",
      "status": "pass",
      "path": "evidence/native-arm64-run-32357865925-job-96390868682.log",